[
  {
    "fault_id": "OVH-REC-01",
    "title": "Late lob recognition",
    "domain": "Recognition",
    "phase_origin": "O0",
    "phase_visible_effect": "O3",
    "default_status": "FAULT_SUSPECTED",
    "minimum_comparable_strokes": 3,
    "detection": "side-on turn begins after ball enters critical overhead zone",
    "context_gates": [],
    "exclusions": [],
    "supported_views": [
      "rear_oblique",
      "side",
      "rear",
      "front_oblique"
    ],
    "measurement_class": "MEASURED_OR_ESTIMATED",
    "performance_consequence": "reduces positioning time",
    "player_message": "Recognize the lob and turn immediately.",
    "coach_message_template": "Late lob recognition: {evidence_summary}.",
    "overlay_markers": [
      "BALL_TRAIL",
      "TIMING_DELTA"
    ],
    "drill_ids": [
      "OVH_READ_01"
    ],
    "severity_policy": {
      "default": "medium",
      "escalate_when": [
        "recurrence>=0.70",
        "outcome_correlation>=0.50",
        "confidence.interpretation>=0.85"
      ]
    },
    "no_score_when": [
      "measurement_confidence<0.65",
      "camera_suitability=unsupported",
      "required_evidence_missing"
    ]
  },
  {
    "fault_id": "OVH-FOOT-01",
    "title": "Inefficient backward movement",
    "domain": "Positioning",
    "phase_origin": "O1",
    "phase_visible_effect": "O3",
    "default_status": "FAULT_SUSPECTED",
    "minimum_comparable_strokes": 3,
    "detection": "feet retreat without effective side-on crossover or adjustment pattern",
    "context_gates": [],
    "exclusions": [],
    "supported_views": [
      "rear_oblique",
      "side",
      "rear",
      "front_oblique"
    ],
    "measurement_class": "MEASURED_OR_ESTIMATED",
    "performance_consequence": "makes tracking and positioning less stable",
    "player_message": "Turn and use crossover steps to get behind the ball.",
    "coach_message_template": "Inefficient backward movement: {evidence_summary}.",
    "overlay_markers": [
      "FOOT_TRAIL",
      "CORRECTION_ARROW"
    ],
    "drill_ids": [
      "OVH_FOOTWORK_01"
    ],
    "severity_policy": {
      "default": "medium",
      "escalate_when": [
        "recurrence>=0.70",
        "outcome_correlation>=0.50",
        "confidence.interpretation>=0.85"
      ]
    },
    "no_score_when": [
      "measurement_confidence<0.65",
      "camera_suitability=unsupported",
      "required_evidence_missing"
    ]
  },
  {
    "fault_id": "OVH-POS-01",
    "title": "Player moves directly under ball",
    "domain": "Spacing",
    "phase_origin": "O1",
    "phase_visible_effect": "O5",
    "default_status": "FAULT_SUSPECTED",
    "minimum_comparable_strokes": 3,
    "detection": "ball projection passes too close to head/trunk",
    "context_gates": [],
    "exclusions": [],
    "supported_views": [
      "rear_oblique",
      "side",
      "rear",
      "front_oblique"
    ],
    "measurement_class": "MEASURED_OR_ESTIMATED",
    "performance_consequence": "removes room for a full swing",
    "player_message": "Move slightly behind and beside the ball.",
    "coach_message_template": "Player moves directly under ball: {evidence_summary}.",
    "overlay_markers": [
      "PROJECTED_BALL_PATH",
      "TRUNK_AXIS",
      "CONTACT_WINDOW"
    ],
    "drill_ids": [
      "OVH_SPACING_01"
    ],
    "severity_policy": {
      "default": "medium",
      "escalate_when": [
        "recurrence>=0.70",
        "outcome_correlation>=0.50",
        "confidence.interpretation>=0.85"
      ]
    },
    "no_score_when": [
      "measurement_confidence<0.65",
      "camera_suitability=unsupported",
      "required_evidence_missing"
    ]
  },
  {
    "fault_id": "OVH-POS-02",
    "title": "Ball allowed to drop",
    "domain": "Contact",
    "phase_origin": "O2",
    "phase_visible_effect": "O5",
    "default_status": "FAULT_SUSPECTED",
    "minimum_comparable_strokes": 3,
    "detection": "contact height is low relative to reachable envelope and available time",
    "context_gates": [],
    "exclusions": [],
    "supported_views": [
      "rear_oblique",
      "side",
      "rear",
      "front_oblique"
    ],
    "measurement_class": "MEASURED_OR_ESTIMATED",
    "performance_consequence": "reduces leverage and put-away potential",
    "player_message": "Take the ball higher.",
    "coach_message_template": "Ball allowed to drop: {evidence_summary}.",
    "overlay_markers": [
      "CONTACT_POINT",
      "CONTACT_WINDOW"
    ],
    "drill_ids": [
      "OVH_HIGH_CONTACT_01"
    ],
    "severity_policy": {
      "default": "medium",
      "escalate_when": [
        "recurrence>=0.70",
        "outcome_correlation>=0.50",
        "confidence.interpretation>=0.85"
      ]
    },
    "no_score_when": [
      "measurement_confidence<0.65",
      "camera_suitability=unsupported",
      "required_evidence_missing"
    ]
  },
  {
    "fault_id": "OVH-ARM-01",
    "title": "Pointing arm drops early",
    "domain": "Stability",
    "phase_origin": "O2",
    "phase_visible_effect": "O4",
    "default_status": "FAULT_SUSPECTED",
    "minimum_comparable_strokes": 3,
    "detection": "non-dominant arm descends before acceleration window",
    "context_gates": [],
    "exclusions": [],
    "supported_views": [
      "rear_oblique",
      "side",
      "rear",
      "front_oblique"
    ],
    "measurement_class": "MEASURED_OR_ESTIMATED",
    "performance_consequence": "reduces tracking and shoulder-set support",
    "player_message": "Keep the pointing arm up longer.",
    "coach_message_template": "Pointing arm drops early: {evidence_summary}.",
    "overlay_markers": [
      "BODY_SKELETON",
      "TIMING_DELTA"
    ],
    "drill_ids": [
      "OVH_POINT_01"
    ],
    "severity_policy": {
      "default": "medium",
      "escalate_when": [
        "recurrence>=0.70",
        "outcome_correlation>=0.50",
        "confidence.interpretation>=0.85"
      ]
    },
    "no_score_when": [
      "measurement_confidence<0.65",
      "camera_suitability=unsupported",
      "required_evidence_missing"
    ]
  },
  {
    "fault_id": "OVH-TROPHY-01",
    "title": "No side-on set position",
    "domain": "Preparation",
    "phase_origin": "O1",
    "phase_visible_effect": "O4",
    "default_status": "FAULT_SUSPECTED",
    "minimum_comparable_strokes": 3,
    "detection": "shoulders remain square and racket does not reach controlled set",
    "context_gates": [],
    "exclusions": [],
    "supported_views": [
      "rear_oblique",
      "side",
      "rear",
      "front_oblique"
    ],
    "measurement_class": "MEASURED_OR_ESTIMATED",
    "performance_consequence": "reduces body contribution and timing",
    "player_message": "Turn side-on and set the racket early.",
    "coach_message_template": "No side-on set position: {evidence_summary}.",
    "overlay_markers": [
      "SHOULDER_LINE",
      "RACKET_PATH",
      "TARGET_GHOST"
    ],
    "drill_ids": [
      "OVH_SET_01"
    ],
    "severity_policy": {
      "default": "medium",
      "escalate_when": [
        "recurrence>=0.70",
        "outcome_correlation>=0.50",
        "confidence.interpretation>=0.85"
      ]
    },
    "no_score_when": [
      "measurement_confidence<0.65",
      "camera_suitability=unsupported",
      "required_evidence_missing"
    ]
  },
  {
    "fault_id": "OVH-SEQ-01",
    "title": "Arm-only acceleration",
    "domain": "Sequencing",
    "phase_origin": "O3",
    "phase_visible_effect": "O5",
    "default_status": "FAULT_SUSPECTED",
    "minimum_comparable_strokes": 3,
    "detection": "racket accelerates with little prior leg or trunk contribution",
    "context_gates": [],
    "exclusions": [],
    "supported_views": [
      "rear_oblique",
      "side",
      "rear",
      "front_oblique"
    ],
    "measurement_class": "INFERRED",
    "performance_consequence": "makes power effortful and less repeatable",
    "player_message": "Use your legs and body before the arm releases.",
    "coach_message_template": "Arm-only acceleration: {evidence_summary}.",
    "overlay_markers": [
      "SEQUENCE_RIBBON",
      "RACKET_PATH"
    ],
    "drill_ids": [
      "OVH_SEQUENCE_01"
    ],
    "severity_policy": {
      "default": "medium",
      "escalate_when": [
        "recurrence>=0.70",
        "outcome_correlation>=0.50",
        "confidence.interpretation>=0.85"
      ]
    },
    "no_score_when": [
      "measurement_confidence<0.65",
      "camera_suitability=unsupported",
      "required_evidence_missing"
    ]
  },
  {
    "fault_id": "OVH-HEAD-01",
    "title": "Head releases before contact",
    "domain": "Stability",
    "phase_origin": "O4",
    "phase_visible_effect": "O5",
    "default_status": "FAULT_SUSPECTED",
    "minimum_comparable_strokes": 3,
    "detection": "head turns or drops before impact",
    "context_gates": [],
    "exclusions": [],
    "supported_views": [
      "rear_oblique",
      "side",
      "rear",
      "front_oblique"
    ],
    "measurement_class": "MEASURED_OR_ESTIMATED",
    "performance_consequence": "reduces tracking accuracy",
    "player_message": "Keep looking at the ball through contact.",
    "coach_message_template": "Head releases before contact: {evidence_summary}.",
    "overlay_markers": [
      "HEAD_AXIS",
      "STABILITY_HALO"
    ],
    "drill_ids": [
      "OVH_HEAD_01"
    ],
    "severity_policy": {
      "default": "medium",
      "escalate_when": [
        "recurrence>=0.70",
        "outcome_correlation>=0.50",
        "confidence.interpretation>=0.85"
      ]
    },
    "no_score_when": [
      "measurement_confidence<0.65",
      "camera_suitability=unsupported",
      "required_evidence_missing"
    ]
  },
  {
    "fault_id": "OVH-CON-01",
    "title": "Contact beside or behind head",
    "domain": "Contact",
    "phase_origin": "O2",
    "phase_visible_effect": "O5",
    "default_status": "FAULT_SUSPECTED",
    "minimum_comparable_strokes": 3,
    "detection": "contact falls outside front-overhead reach corridor",